user,text,displayed_time,datetime_value
@pelavarre,""""""" BTW if you are an engineer nodding along to this, come work with Julie Zhuo @TeamSundial ! Looking for generalists in Bay Area with 2+ years experience, obsessed with AI and analytically rigorous. DMs are open """"""",Aug 6,2025-08-06T00:50:09.000Z
@joulee,"BTW if you are an engineer nodding along to this, come work with me @TeamSundial ! Looking for generalists in Bay Area with 2+ years experience, obsessed with AI and analytically rigorous. DMs are open.",Aug 6,2025-08-06T00:16:46.000Z
@wickedSchema,"I am interested, I have been looking for an opportunity like this to put my hand on Ai development. Currently a backend engineer, I would love to have hands on project on this. Pleaaaaseeeeeeeeeeeee",Aug 5,2025-08-05T19:53:38.000Z
@stratifixyz,Hiring: ML Engineer to help us train smarter. We’re building AI agents to automate yield farming in DeFi. Now looking for an ML Engineer to help us build the brains behind it. You’ll: – Work with onchain data – Train models for strategy optimization – Collaborate with DeFi,Aug 4,2025-08-04T16:08:55.000Z
@Expertia_Jobs,Ready to power up IT infrastructure? EIL Global IT Solutions and Services Pvt Ltd is looking for an ICT Infrastructure Engineer! Dive into the future of technology with us. Apply now: expertia.ai/eilglobal/job/ … #expertiaJobs #hiring,Aug 4,2025-08-04T10:02:48.000Z
@stannostudio,"Looking for a killer iOS engineer (SwiftUI) to join me in building @soarapp . Early traction, funded, AI cooking, just need someone who can help us move fast and ship. bonus if you’ve got an eye for design & animation. DM or tag someone great.",Aug 3,2025-08-03T19:40:30.000Z
@nkohari,"If you want to work at an early stage startup, but don't want to deal with toxic nonsense like this: ardent.ai/careers We're looking for a founding engineer and designer. $250K/year + 1% equity, full benefits, 401(k) match. More about us: ardent.ai/company",Aug 3,2025-08-03T19:32:06.000Z
@arkslife,"We’re looking for an AI/ML engineer (video-focused) to join @petpinai . If you’re into pets, viral content, and training models on real pet moments that stick and spread, reach out. SF based is a plus. DM me or tag someone perfect for this",Aug 3,2025-08-03T14:45:39.000Z
@geverduin,Friend is looking for a great founding engineer for their AI startup with an ambitious and worthy mission. My DMs are open if you want more info and an intro,Jul 29,2025-07-29T04:38:34.000Z
@danshipper,"i'm looking for a social media engineer for @every . this is you if you: - are an extremely online poaster - love AI and building quick apps and MVPs with agents - are multidimensional (love writing, code, philosophy, art, etc) - are multithreaded (comfortable working on a bunch",Jul 28,2025-07-28T15:43:42.000Z
@Bear_In_Site,I'm best maximized when I'm around idea guys. I'm an AI engineer looking for interesting work. Willing to work by the project,Jul 28,2025-07-28T14:10:39.000Z
@mudit_bhargava_,"Building an AI-powered Equalization & BER Prediction engine for SerDes validation inside SVF. Need help: If you're a company or SerDes engineer with waveform datasets (eye diagrams, BER vs voltage sweeps, TX EQ configs), I'm looking to collaborate—DMs open. #PCIe #SerDes #AI",Jul 26,2025-07-26T19:57:01.000Z
@JadeWillia87063,"Looking for an ML/AI engineer for a project-based role. Small, focused build — ideal for someone who loves shipping fast and smart. Remote OK. If you're hands-on with models, data & deployment — DM me for details. #AIJobs #MLContract #FreelanceAI #TechJobs",Jul 25,2025-07-25T08:38:27.000Z
@lucifer_x007,"Hey folks! I'm looking for new roles as an AI/ML - NLP Engineer ( mid level ) YOE - 3.7 years Btech - ECE, 2022 Intern @ IISc, Bangalore in Speec and Vision - Immediate Joiner - Open to Remote / Hybrid — BLR | HYD | MUM | DEL | PUN | MAA Full Resume Link: In Reply Share",Jul 25,2025-07-25T04:42:39.000Z
@dvc_collective,"DVC is hiring! We’re building an open-source, AI-native VC stack — and looking for a Senior Python Backend Engineer (remote ). Work on: Data pipelines Portfolio dashboards Event-driven systems AI/ML integrations Apply here →",Jul 25,2025-07-24T21:26:06.000Z
@mr_dmj1,"Looking for talented folks to work on an exciting project: 1. Backend engineer: experience working with LLMs & AI systems. 2. Mobile dev: If you have cross-platform experience and can translate designs into pixel-perfect code, we need to talk. DM me if any of this is you.",Jul 24,2025-07-24T09:31:03.000Z
@PlutoEducation,"Hiring Update! Looking for an AI Engineer – Computer Vision & GenAI Specialist @KAUST Deadline: Aug 15, 2025 Apply: plutoedu.com/form/792303151 #AI #Hiring #ComputerVision #GenerativeAI #KAUST #XrayCT #DeepLearning",Jul 24,2025-07-24T07:42:07.000Z
@Belialoglu,Good morning friends. The ways @Infinit_Labs combines decentralized infrastructure with AI tools are making real-world services more accessible. You don't need to be an engineer to see the value here. They're creating smoother paths for developers and creators looking to,Jul 24,2025-07-24T05:51:22.000Z
@Flomerboy,if I was an engineer looking for a high growth startup opportunity I think I'd be most excited about Mastra mastra.ai/careers just based on my experience as a customer,Jul 23,2025-07-23T17:18:32.000Z
@ericjang11,I'm looking to hire a full-stack robot learning engineer who has good software taste and is looking to post-train our Redwood AI model for an existing 1X customer in Asia. this is someone who can ship incredibly fast (can code on the floor of the customer warehouse / factory /,Jul 20,2025-07-20T18:47:15.000Z
@Krishna__Bansal,"I've taken @doesmyideaexist a solo project to a viral tool with real validation. Now, it's time to build the empire. I'm looking for two key partners: A growth/marketing lead obsessed with building a world-class brand. An AI/ML engineer who wants to build the next apple.",Jul 20,2025-07-20T08:28:15.000Z
@heyadam,I’m hiring for an exciting and rare opportunity at Meta! We’re looking for a Design Engineer to help build the future of our AI design tools. Full details:,Jul 19,2025-07-19T15:00:40.000Z
@orcatwt,"We're Hiring! Looking for an experienced Senior AI ML Engineer at Sereno. If you are interested, Please share your proof of work with a small introduction in comment section. Or, feel free to tag your friends. Position Summary: surl.li/ovtrwj Thank you!",Jul 19,2025-07-19T09:15:30.000Z
@abhisheknaironx,"This is the CEO of Zapier quoting the Global DevRel of Intel. Everyone is looking for an AI automation engineer, and don't confuse it with an AI engineer. AI/ML engineers are everywhere, & the field is quite saturated. AAEs are different and more useful. How to get hired:",Jul 19,2025-07-19T07:01:02.000Z
@dr_mccarron,"@stefan_hamann Question, are you currently working on a big project? We are looking for an engineer for a Ai Agent project. I read your last post, I believe it was your last, and that’s all I needed to know you would fit the bill. Please let me know if this peaks your",Jul 17,2025-07-17T06:36:56.000Z
@code_kartik,"Now that my time at @puch_ai has wrapped, I’m actively looking for full-time or internship opportunities as an AI Engineer or Software Engineer (AI). If you're building something exciting in the AI space, I'd love to be part of it. DMs open Proof of work above",Jul 16,2025-07-16T12:04:44.000Z
@SaveLibertyUS,SpaceX is looking for an AI software engineer to be a founding member of its AI software engineering team,Jul 15,2025-07-15T14:33:14.000Z
@DijobsUK,"NEW JOB: Chemical Engineer - AI Trainer: Birmingham, ENG, United Kingdom DataAnnotation We are looking for an *advanced chemist* to join our team to train AI models. You will measure the progress of these AI chatbots, evaluate… dlvr.it/TLwSMG #jobs #jobsearch #hiring",Jul 15,2025-07-15T07:10:33.000Z
@luv38376444,"If you are really looking for an AI engineer with 5 years of experience, forward your job postings, I will apply. Prior to AI, I used PlayWright and Typescript. I should be a great candidate. Previous supervisor will vouch for me, he is Indian. I'm American, post it here.",Jul 15,2025-07-14T22:27:43.000Z
@Khrisemeka,"Hi, Good evening, please is it possible to know the name of the startup? I am looking for places to do an internship at. I am a FullStack Engineer and AI Engineer",Jul 7,2025-07-07T17:59:48.000Z
@dataengbytes,"Sydney, say hi to Kaarthik Andavar. By day he’s an Intermediate Data Engineer at Tracksuit, by night an AI tinkerer always looking for ways to make data simpler for everyone. Catch him live at DataEngBytes Sydney. dataengbytes.com/sydney",Jul 7,2025-07-07T04:00:03.000Z
@bartbrejcha,Looking for Problem solving and an enquiring minds jobs.designengine.com/jobs/mechanica … Mechanical Engineer #Solidworks #engineeringjobs Encouraged to use #ai for engineering,Jul 6,2025-07-06T12:38:51.000Z
@ClickIT_Tech,"Hiring an #AIdeveloper isn’t like hiring any other engineer. You're looking for someone who understands data, frameworks, cloud, ethics, and your industry-specific goals. This guide will help you: clickittech.com/ai/hire-ai-dev … #hireAIdevelopers #AIengineers",Jul 4,2025-07-03T21:23:01.000Z
@vignesh_0330,Looking for an ML engineer who ships fast? I’ve built: • Health risk predictor (94% acc) • Resume analyzer w/ ATS PDFs • AI emotion detector for chatbots • Real-time dashboards w/ FlaskPython | Scikit-learn | PyTorch | GPT | FastAPI Let’s build your AI tool. DMs open,Jul 3,2025-07-03T14:59:45.000Z
@liqiang_ding,"Looking for feedbacks on my ai project. :) I'm Liqiang, an engineer and audiobook lover. I built AudioFlo.ai because I was always frustrated that so many great books don’t have audio versions. So I created a tool that turns ebooks into natural-sounding audiobooks",Jul 2,2025-07-02T19:00:45.000Z
@negusbrc03,"Ash wants to build “an ai company like Harvey, specifically aimed at helping the Architecture, Engineering, and Construction industry” and is looking for a co-founder. He just finished his Yale MBA and previously was a civil engineer for four years. Reach out:",Jul 2,2025-07-02T04:01:26.000Z
@omoalhajaabiola,"Ash wants to build “an ai company like Harvey, specifically aimed at helping the Architecture, Engineering, and Construction industry” and is looking for a co-founder. He just finished his Yale MBA and previously was a civil engineer for four years. Reach out:",Jul 1,2025-07-01T18:55:34.000Z
@bigBash25,"The @recallnet flagship hackathon officially kicked off yesterday with a $35,000 prize pool up for grabs! If you're an AI engineer, crypto dev, Web3 explorer, or a builder looking to break into agent-based applications — this is your moment to dive into the future of AI + crypto",Jul 1,2025-07-01T08:32:42.000Z
@devdixit07,Hey buddy are u Looking for AI engineer? This is my AI portfolio which is not just a static page but an interactive LLM -,Jul 1,2025-07-01T03:57:17.000Z
@engr_ali_nawaz,Excited to share that I’ve joined InvoZone as a Senior AI/ML Engineer! Grateful for the opportunity and the trust placed in me. Looking forward to building impactful AI solutions with an amazing team! Let’s make it count. #NewBeginnings #AI #MachineLearning #InvoZone,Jun 27,2025-06-27T03:20:20.000Z
@BorjaGVO,"What are you looking for in an AI automation engineer? Fluency with langchain, n8n? Something else?",Jun 26,2025-06-26T06:42:35.000Z
@AyoroaGabe,Building FixMate AI: an AI-powered handyman platform for Airbnb hosts/ operators Snap photo → AI diagnoses → instant quote → tech dispatched Looking for a technical co-founder or founding engineer (AI/backend)DM me. Let’s build. #startups #buildinpublic #AI #proptech,Jun 25,2025-06-25T14:59:57.000Z
@libertystrikes2,I'm an AI engineer looking for work. They don't like hiring Irish people.,Jun 24,2025-06-24T16:22:11.000Z
@Avinashabroy,[Hiring] – AI/ML Engineer D3V Technology Solutions is looking for an AI/ML Engineer to join our remote team (India-based applicants only). Details: d3vtech.com/careers/ Apply here: forms.clickup.com/8594056/f/868m …,Jun 24,2025-06-24T12:21:56.000Z
@alexcooldev,"I’ve heard of cloud-native for years. But today I saw a job post looking for an AI-native engineer had to click out of curiosity. Turns out they’re looking for someone to build products where AI is at the core not just slapped on after. Then it hit me: Wait, isn’t my product",Jun 24,2025-06-24T07:40:56.000Z
@relizarov,"Properly using AI becomes a critical skill in software engineer's performance. You can literally spend an hour carefully reviewing hundreds of lines of code with dense logic, looking for a bug, or, with a proper prompt, context, and a right model, get it found in a few minutes.",Jun 24,2025-06-23T22:25:29.000Z
@suvodeep_dev,"I’m a full-stack developer and AI Engineer specializing in building AI-powered web applications and SaaS tools. Currently developing DeepHire — an AI voice interview app. If you’re looking for reliable freelance help with React, Next.js, Python, or AI projects, feel free to DM me",Jun 23,2025-06-23T06:29:02.000Z
@FJ000RD,Your expertise isn't becoming obsolete; it's becoming more critical. Anyone can talk to a chatbot. Only an engineer can build a scalable system of them. Stop looking for the smartest model. Start building the smartest system. Follow me if you build AI systems that actually,Jun 18,2025-06-18T16:54:30.000Z
@UniverseOfWeb3,"#hiring! @VAYUZTech is looking for an AI Prompt Engineer to join the team! Know more and apply here: tinyurl.com/bparhu7z Go to the dashboard and click ""All Jobs"" to apply based on your profile! #AI #Prompt #Engineer #Jobs #Web3Universe #JobOpportunity #fulltime #vayuz",Jun 18,2025-06-18T11:48:39.000Z
@alex_teichman,If you’re an AI engineer in SF looking for something new hmu,Jun 17,2025-06-17T04:45:33.000Z
@mihail_eric,"Are you a CS grad looking for an AI engineering job? Here’s the #1 skill you should focus on: Systems evaluation. I’ve interviewed 112 AI engineer candidates. Most were talented. Many were great developers. If they fell short here, they got rejected. 𝗦𝗼, 𝘄𝗵𝗮𝘁 𝗶𝘀",Jun 16,2025-06-16T17:05:18.000Z
@forgestudioai,We're Currently seeking a technical co-founder to join us. Looking for someone who's: -An experienced backend Engineer -Has experience with AI/ML -Cares about design -In the US (Preferably NYC) DM if interested,Jun 9,2025-06-08T22:27:24.000Z
@brentmwarner,Currently seeking a technical co-founder to join us at forgestudio.ai Looking for someone who's: -An experienced backend Engineer -Has experience with AI/ML -Cares about design -In the US (Preferably NYC) DM me here if you're interested,Jun 9,2025-06-08T22:26:23.000Z
@n00buntu,> Looking for an engineer with experience in running small LLMs on phone chip sets. @comma_ai this sounds like your wheelhouse!,Jun 7,2025-06-06T21:36:00.000Z
@HireWithNear,"The cost of hiring an AI engineer in 2025 might shock you. A mid-level AI engineer in the US? $139,000 a year. Add benefits, taxes, and perks—and you’re looking at 30–40% more. This is why companies are looking to regions like Latin America, India, and Poland for top-tier",Jun 5,2025-06-05T17:00:09.000Z
@jobsincrypto,. @InstituteFT is hiring! Institute of Free Technology is looking for an AI Operations Specialist to join their talented team and help build the decentralized future. AI Operations Specialist Remote Full-Time $60K – $90K Apply now,Jun 5,2025-06-05T06:00:25.000Z
@jevakallio,"We're also looking for an ""AI Engineer"" (whatever that is ) to help us build the infra behind Marker's intelligent editorial assistants. This is a full-stack role, building on Cloudflare. London, £100-£150k, flex in site and comp for exceptional fit writewithmarker.com/jobs/ai-engine …",Jun 3,2025-06-03T14:15:44.000Z
@ChalkboardMav,LOOKING FOR FEEDBACK… I’m thinking about creating an “AI prompt engineer” course for kids. The value is to teach kids to “BUILD SOMETHING” rather than…Simply “write essays for school”… I mean the teachers create assignments and mark them using AI….kids are writing using,Jun 3,2025-06-03T00:40:26.000Z
@BenCostaTesla,"I'm looking to immediately hire an Autopilot Test Engineer in Tempe, AZ. Looking for someone with ADAS L2+, python scripting, and vehicle in loop testing experience to help accelerate productionization of Robotaxi. @Tesla_AI @Tesla",Jun 3,2025-06-02T22:21:23.000Z
@j_apollum,i am looking for an AI Engineer who have exp in AI-centric blockchain app.,Jun 2,2025-06-02T16:46:19.000Z
@VamZKrsna,"cfbr bruv , also if a recruiter is reading this, iam an ai engineer looking for an entry level role. Here's my GitHub:",Jun 2,2025-06-02T15:11:57.000Z
@GabGarrett,What evidence are you specifically looking for? My life is completely changed as an engineer and every engineer I teach how to use AI agentic coding tools suddenly have much much more free time and are much happier,May 31,2025-05-31T13:55:58.000Z
@juliankmazo,"If you're thinking about how to become an AI engineer and looking for your next adventure, you should watch @janvikalra_ 's interview!",May 30,2025-05-30T14:39:36.000Z
@jonsantillan,"Looking for help @buildinpublic We’ve been using @cursor_ai for a while, but I know we’re only scratching the surface. Looking for an engineer who actually codes with Cursor or @windsurf_ai daily and knows how to get the most out of it. We’re looking for someone who can:",May 30,2025-05-30T08:38:04.000Z
@ohogroup,"Job Opportunity for an AI Engineer! An exciting, well-funded start-up is looking for an AI Engineer to join their fast-growing team. You will be working with the CEO, and help shape the business as it grows. Apply now! buff.ly/5JIPo0J",May 28,2025-05-28T09:01:34.000Z
@gafyndavies,"The state of music today! I found this on a job board - ""We are looking for a skilled musician or audio engineer to add an AI-generated cello part to the end of our song track."" Why do they need a skilled musician if the part needs to be AI generated?",May 28,2025-05-28T07:03:00.000Z
@abielzulio,"i'm looking for an AI engineer specialized in GPU optimization: → gross salary up to IDR 17 million/mo → 3 days WFO → Indonesian-based company, global market if this sounds exciting for you, send me a CV!",May 27,2025-05-27T11:30:40.000Z
@manojnandanwar_,"We’re looking for an AI/ML Engineer If you think in algorithms and love training models, we want you! Apply at: hr@genixbit.com #ArtificialIntelligence #MachineLearning #AIJobs #Hiring",May 27,2025-05-27T03:50:16.000Z
@WilliamsComment,"Fantastic. I'm looking forward to it. DM me if you prefer. I used to be a recording engineer. Cancer altered my voice some years ago, so singing for me is not an option. So, I use AI instead of musicians.",May 27,2025-05-27T01:40:47.000Z
@TambiYash78,@julianweisser I’m looking for Founding Engineer roles using AI tools. Have been working as a Founding Engineer for past 3 months; built an ios app in just 3 weeks to MVP!,May 26,2025-05-26T20:24:27.000Z
